{
  "id": "phase11-hiroshima-normalization",
  "phase": 11,
  "status": "normalized",
  "prefecture_code": "34",
  "source_catalogs": [
    "data/reviewed/hiroshima_revised_vision_indicators_part1.json",
    "data/reviewed/hiroshima_revised_vision_indicators_part2.json",
    "data/reviewed/hiroshima_revised_vision_indicators_part3.json"
  ],
  "source_review_manifest": "data/catalog/hiroshima_revised_vision_indicator_review_manifest.json",
  "normalizer": "scripts/normalize_phase11_hiroshima.py",
  "record_schema": "schemas/phase11_record_linkage.schema.json",
  "expected_normalization": {
    "record_count": 62,
    "linked_record_count": 59,
    "partial_record_count": 3,
    "not_linked_record_count": 0,
    "policy_area_count": 17,
    "pending_measurement_record_count": 3,
    "qualitative_target_record_count": 1,
    "policy_achievement_assessment_count": 0
  },
  "promotion_rule": "An indicator is linked only when the revised vision records a current observation. A dash or a future first-survey statement remains partial even when a target is present.",
  "raw_text_boundary": "Baseline, current, and target strings remain intact because a single official cell may contain multiple series, national comparators, averages, approximate values, decrease semantics, or qualitative conditions.",
  "non_goals": [
    "Do not split raw compound strings into inferred series without a reviewed source structure.",
    "Do not treat definition changes, replacements, or revised targets as achievement judgments.",
    "Do not convert pending measurements into zero or carry values from deleted indicators.",
    "Do not rank Hiroshima against other prefectures before comparability is verified."
  ],
  "updated_at": "2026-08-02"
}
